{
  "schema_version": "day31-readiness-decision.v1",
  "status": "GO_FOR_DAY32_SEPARATE_BASELINE_SMOKE",
  "pass": true,
  "failed_gates": [],
  "training_allowed": false,
  "model_fitting_allowed": false,
  "scaler_fitting_allowed": false,
  "pooled_training_allowed": false,
  "test_signal_access_allowed": false,
  "test_set_opened": false,
  "fatigue_inference_allowed": false,
  "clinical_use_allowed": false
}
